{
  "$schema": "https://productbuildershq.com/schema/scale/v0/scale-assessment.schema.json",
  "frameworkId": "scale",
  "period": "2026-Q3",
  "asOf": "2026-08-04",
  "observations": [
    {
      "metricId": "platform.standards.mogo-exists",
      "value": 1,
      "note": "mogo v0.77.0 released with 200+ packages, full godoc coverage"
    },
    {
      "metricId": "platform.consumption.mogo-adoption",
      "value": 28.9,
      "numerator": 201,
      "denominator": 696,
      "note": "201 repos in grokify org depend on mogo (28.9%)"
    },
    {
      "metricId": "platform.consumption.gohttp-adoption",
      "value": 0.7,
      "numerator": 5,
      "denominator": 696,
      "note": "5 repos depend on gohttp in grokify org"
    },
    {
      "metricId": "platform.standards.omniagent-exists",
      "value": 1,
      "note": "omniagent framework active with gateway, tools, context packages"
    },
    {
      "metricId": "platform.consumption.omniagent-adoption",
      "value": 2,
      "numerator": 2,
      "denominator": 163,
      "note": "2 repos (agentos, omniagent-starter) depend on omniagent in plexusone"
    },
    {
      "metricId": "platform.leverage.omniagent-tools-reused",
      "value": 15,
      "note": "15+ tool implementations in omniagent: bash, read, write, edit, grep, glob, mcp, web, etc."
    },
    {
      "metricId": "platform.standards.visionstudio-exists",
      "value": 1,
      "note": "VisionStudio dashboard operational with React SPA and Go API"
    },
    {
      "metricId": "platform.consumption.visionstudio-repos-tracked",
      "value": 25,
      "note": "25 repositories registered across ProductBuildersHQ and plexusone"
    },
    {
      "metricId": "platform.consumption.initiatives-with-roadmaps",
      "value": 60,
      "numerator": 6,
      "denominator": 10,
      "note": "6 of 10 initiatives have structured ROADMAP.md with RMI tracking"
    },
    {
      "metricId": "platform.standards.gogit-exists",
      "value": 1,
      "note": "gogit v0.3.0 with scanner, parallel execution, gitscan CLI"
    },
    {
      "metricId": "platform.consumption.gogit-adoption",
      "value": 1,
      "numerator": 1,
      "denominator": 696,
      "note": "gogit self-referential; adoption expanding via omnidevx"
    },
    {
      "metricId": "platform.automation.gitscan-ci",
      "value": 0,
      "note": "gitscan used interactively; CI integration not yet deployed"
    },
    {
      "metricId": "platform.standards.scale-exists",
      "value": 1,
      "note": "SCALE framework v0.1.0 with 4 domains, rollup computation, HTML reports"
    },
    {
      "metricId": "platform.consumption.scale-domains",
      "value": 4,
      "note": "4 domains: api, observability, security, platform"
    },
    {
      "metricId": "platform.consumption.scale-assessments",
      "value": 1,
      "note": "First platform assessment (this document)"
    },
    {
      "metricId": "platform.consumption.repos-no-replace",
      "value": 92,
      "numerator": 640,
      "denominator": 696,
      "note": "92% of repos have no replace directives in go.mod"
    },
    {
      "metricId": "platform.consumption.repos-module-match",
      "value": 98,
      "numerator": 682,
      "denominator": 696,
      "note": "98% of repos have module name matching directory structure"
    },
    {
      "metricId": "platform.automation.dependency-order-ci",
      "value": 0,
      "note": "gitscan order available but not yet integrated into release workflow"
    },
    {
      "metricId": "platform.effectiveness.dependency-conflicts",
      "value": 0,
      "note": "No dependency conflict incidents reported in Q3"
    },
    {
      "metricId": "platform.leverage.shared-deps-ratio",
      "value": 15,
      "note": "Estimated 15% of dependencies are internal platform libraries"
    },
    {
      "metricId": "platform.leverage.code-reuse-loc",
      "value": 75000,
      "note": "Estimated 75K LOC not written due to mogo/gohttp/gogit reuse"
    },
    {
      "metricId": "platform.effectiveness.platform-bugs-fixed-once",
      "value": 8,
      "note": "8 bugs fixed in mogo that benefited all adopters via version bump"
    }
  ],
  "narratives": [
    {
      "id": "platform-journey-2026q3",
      "kind": "journey",
      "title": "Platform Adoption Q3 2026",
      "scope": { "type": "domain", "ref": "platform" },
      "body": "Q3 focused on establishing the SCALE measurement framework and baselining platform adoption metrics. Key achievements: (1) mogo remains the most widely adopted library at 29% penetration across 696 repos, (2) omniagent framework reached production readiness with 2 dependent projects, (3) VisionStudio dashboard now tracks 25 repositories across initiatives. Dependency hygiene is strong: 92% of repos have no replace directives and 98% have matching module names.",
      "owner": "platform-engineering",
      "asOf": "2026-08-04"
    },
    {
      "id": "platform-outlook-2026q3",
      "kind": "outlook",
      "title": "Platform Adoption Q4 Goals",
      "scope": { "type": "domain", "ref": "platform" },
      "body": "Q4 priorities: (1) Increase omniagent adoption from 2 to 5+ projects by improving onboarding docs and starter templates, (2) Integrate gitscan into CI for automated dependency ordering, (3) Expand SCALE assessments to cover api and observability domains, (4) Target 35% mogo adoption by promoting to plexusone repos not yet adopting.",
      "owner": "platform-engineering",
      "reviewBy": "2027-01-15",
      "initiatives": ["INIT-PLATFORM-001", "INIT-PLATFORM-002"]
    }
  ]
}
